,Öğrenci No,Ad Soyad,Bölüm,Sınıf,Devam Drm
0,151301018,NİLAY YORGANCILAR,Endüstri Mühendisliği Lisans Programı,4,Devamlı
1,161101005,FURKAN DİNÇ,Bilgisayar Mühendisliği Lisans Programı,4,Devamlı
2,151501022,FURKAN ULUOCAK,Makine Mühendisliği Lisans Programı,4,Devamlı
3,161501021,KAAN ERDİNÇ,Makine Mühendisliği Lisans Programı,4,Devamlı
4,152501029,ATAKAN KAYABEL,Psikoloji Lisans Programı,4,Devamlı
5,151201025,YASİN EMRE TOK,Elektrik ve Elektronik Mühendisliği,4,Devamlı
6,161201017,AHMET ÖMER ARSLAN,Elektrik ve Elektronik Mühendisliği,4,Devamlı
7,154301009,EYLÜL HIFZIOĞLU,Endüstriyel Tasarım Lisans Programı,4,Devamlı
8,154601012,NUREDDİN EBRAR KARAER,Mimarlık Lisans Programı,4,Devamlı
